{"schema_version": "gms.activation-event.v1", "activation_sequence": 2, "event_id": "act-0002", "event_digest": "sha256:b036d162f80b6e2657a50b6d88d5ace123e2059ca070dbd00958698aa027bf84", "event_type": "deactivate", "lineage_id": "sg-commit-checklist", "skill_ref": {"schema_version": "gms.skill-artifact-ref.v1", "lineage_id": "sg-commit-checklist", "version": 3, "kind": "step_guidance", "artifact_digest": "sha256:b7c53f36f80537b1e3a371a212aec1f6273d9fff85dfa28983aa660e97a0d71b"}, "outbox_key": "sha256:eec297f8104ae2ee74f62f9d3c1341d84b27759ebee31c81d7d1c6fa38e84c29", "deactivation_authorization_ref": {"id": "auth-deact-0001", "version": 1, "digest": "sha256:3fc679ddb25810f55d1c3245344f606e689887051a18950919bafb9d661c4aa0"}}
